{
  "metadata": {
    "architecture": "dsv4_resident_decode_stage",
    "module_geometry": {
      "attention_head_count": 128,
      "checkpoint_dspark_layer_count": 1,
      "expert_intermediate_dimension": 3072,
      "experts_per_token": 6,
      "head_dimension": 512,
      "hidden_dimension": 7168,
      "index_head_count": 64,
      "index_head_dimension": 128,
      "index_top_k": 1024,
      "layer_count": 61,
      "packed_dspark_layer_count": 1,
      "routed_expert_count": 384,
      "sliding_window_tokens": 128,
      "vocab_count": 129280
    },
    "precision_contract": {
      "accumulator_codec": "fp32",
      "activation_codec": "bf16",
      "aot_codec_specialization": true,
      "expert_activation_codec": "fp8_e4m3_ue8m0",
      "expert_scale_encoding": "e8m0",
      "expert_scale_group_size": 32,
      "expert_stored_bits": 4,
      "expert_weight_codec": "mxfp4_e2m1",
      "expert_weight_codec_id": 7,
      "fallback_allowed": false,
      "kv_cache_codec": "bf16",
      "linear_weight_codec": "fp8_e4m3",
      "non_expert_activation_codec": "bf16",
      "output_composition_activation_codec": "bf16",
      "runtime_precision_selection": "forbidden"
    },
    "purpose": "DeepSeek V4 Pro resident firmware with checkpoint FP8 non-expert weights, MXFP4 routed-expert weights, BF16 KV cache and FP32 accumulation",
    "qualification": {
      "gpu_latency": "NOT_MEASURED",
      "gpu_numerical_correctness": "NOT_MEASURED",
      "gpu_throughput": "NOT_MEASURED",
      "production_ready": false,
      "status": "NOT_MEASURED"
    },
    "runtime_contract": {
      "completion": "external",
      "configuration_source": "typed model-owned serving adapter configuration",
      "fallback_allowed": false,
      "required_environment": [],
      "runtime_backend_selection": "forbidden",
      "runtime_precision_selection": "forbidden",
      "speculative_decoding": "disabled",
      "speculative_decoding_reason": "checkpoint MTP layer packed but speculation not yet qualified for Pro"
    },
    "source_model": {
      "id": "deepseek-ai/DeepSeek-V4-Pro-0813",
      "revision": "GA release (HF, 2026-08-13)"
    }
  },
  "model": {
    "id": "deepseek.v4.pro.resident-decode-stage-firmware",
    "revision": "h7168-l61-dsa-e384k6-hash3-v129280-ga0813-v1"
  },
  "schema_version": 1,
  "stages": [
    {
      "name": "dsv4_resident_decode_stage",
      "programs": [
        {
          "completion": "external",
          "id": 1,
          "max_inflight": 11,
          "name": "resident_decode",
          "operations": [
            {
              "configuration": {
                "activation_codec": "bf16",
                "expert_activation_codec": "fp8_e4m3_ue8m0",
                "expert_weight_codec": "mxfp4_e2m1",
                "fallback_allowed": false,
                "kv_cache_codec": "bf16",
                "linear_weight_codec": "fp8_e4m3",
                "output_composition_activation_codec": "bf16",
                "runtime_backend_selection": "forbidden",
                "runtime_precision_selection": "forbidden"
              },
              "module": "spark.dsv4.pro.resident_decode_stage.linear_fp8.expert_mxfp4.kv_bf16.h7168.l61.e384.k6.ga0813.b11.v1",
              "name": "dsv4_resident_decode_stage"
            }
          ],
          "scheduling": {
            "device_memcpy_bytes_per_submit_ceiling": 0,
            "flags": [
              "stream_ordered",
              "driver_owns_resident_state",
              "driver_owns_kv_cache",
              "fixed_firmware",
              "requires_hidden_transport",
              "no_file_transport",
              "no_shell_transport"
            ],
            "host_staging_bytes_per_submit_ceiling": 0,
            "max_active_slots": 11,
            "max_new_tokens": 65536,
            "max_resident_sequences": 11,
            "max_sequence_tokens": 1048576,
            "private_queue_count": 0,
            "resident_kv_bytes": 0,
            "resident_weight_bytes": 0,
            "static_workspace_bytes": 0,
            "target_latency_ns": 0,
            "validated_latency_ns": 0
          }
        }
      ],
      "target": "cuda.sm121.dsv4.pro.resident_decode_stage.linear_fp8.expert_mxfp4.kv_bf16"
    }
  ]
}