{
  "schema_version": 1,
  "model": {
    "id": "zai.glm-5.2.resident-sparse-mla-firmware",
    "revision": "bf16-h64-d512-r64-k2048-b64-rope-adjacent-v1"
  },
  "metadata": {
    "architecture": "glm52_resident_sparse_mla",
    "purpose": "exact resident cached-attention firmware with fused RoPE and current-token KV placement",
    "module_geometry": {
      "heads": 64,
      "latent_dimension": 512,
      "rope_dimension": 64,
      "selected_tokens": 2048,
      "kv_block_tokens": 64
    }
  },
  "stages": [
    {
      "name": "resident_attention",
      "target": "cuda.sm121.glm52.resident_sparse_mla.bf16",
      "programs": [
        {
          "name": "decode_attention",
          "id": 1,
          "max_inflight": 64,
          "completion": "external",
          "operations": [
            {
              "name": "resident_sparse_mla",
              "module": "spark.glm52.resident_sparse_mla.bf16.h64.d512.r64.k2048.b64.rope_adjacent.v1",
              "configuration": {}
            }
          ],
          "scheduling": {
            "flags": [
              "stream_ordered",
              "driver_owns_resident_state",
              "driver_owns_kv_cache",
              "zero_copy_node_context",
              "no_host_staging",
              "fixed_firmware",
              "captured_cuda_graph",
              "no_device_memcpy",
              "stream_event_dependencies",
              "batch_shape_fixed"
            ],
            "max_active_slots": 64,
            "max_new_tokens": 1,
            "max_resident_sequences": 64,
            "max_sequence_tokens": 8192,
            "target_latency_ns": 0,
            "validated_latency_ns": 0,
            "resident_weight_bytes": 0,
            "resident_kv_bytes": 0,
            "static_workspace_bytes": 0,
            "device_memcpy_bytes_per_submit_ceiling": 0,
            "host_staging_bytes_per_submit_ceiling": 0,
            "private_queue_count": 0
          }
        }
      ]
    }
  ]
}
