{
    "schema_version": 1,
    "model": {
        "id": "mimo26.resident-decode-stage-firmware",
        "revision": "mimo26flash.mxfp4.tp4.v2"
    },
    "metadata": {
        "architecture": "mimo26_resident_decode_stage",
        "purpose": "resident decode-stage firmware for the MiMo-V2.6-Flash text tower: 48 layers (9 full-attention, 39 sliding-window 128 with sink bias), fp8 block-128 QKV and layer-0 dense MLP, bf16 o_proj, 256 routed MXFP4 experts top-8 sigmoid+bias routing, untied bf16 lm_head; TP4 rank packs, every local expert pinned in the weightd pool",
        "provenance": {
            "status": "in bring-up; TP4 rank engine 48/48 greedy tokens equal the CPU reference and COMPSEC-17 17/17 (w6 receipts)",
            "disclosed_source": [
                "XiaomiMiMo/MiMo-V2.6-Flash-RL text tower, tools/t1_reference_mimo26.py"
            ]
        },
        "module_geometry": {
            "hidden_dimension": 4096,
            "layer_count": 48,
            "query_head_count": 64,
            "kv_head_count_full": 4,
            "kv_head_count_swa": 8,
            "head_dimension": 192,
            "value_dimension": 128,
            "routed_expert_count": 256,
            "experts_per_token": 8,
            "expert_intermediate_dimension": 2048,
            "output_vocab_count": 152576
        },
        "precision": {
            "non_expert_weight_format": "fp8_e4m3_block128 (qkv, layer-0 dense), bf16 (o_proj, norms, router, lm_head)",
            "expert_weight_format": "mxfp4_e2m1_e8m0_g32",
            "activation_format": "bf16",
            "kv_cache_codec": "bf16",
            "accumulator_format": "fp32"
        }
    },
    "stages": [
        {
            "name": "mimo26_resident_decode_stage",
            "target": "cuda.sm121.mimo26.resident_decode_stage.mxfp4",
            "programs": [
                {
                    "name": "resident_decode",
                    "id": 1,
                    "max_inflight": 1,
                    "completion": "submit_return",
                    "scheduling": {
                        "flags": [
                            "stream_ordered",
                            "driver_owns_resident_state",
                            "driver_owns_kv_cache",
                            "fixed_firmware",
                            "requires_hidden_transport",
                            "no_file_transport",
                            "no_shell_transport"
                        ],
                        "max_active_slots": 16,
                        "max_new_tokens": 8192,
                        "max_resident_sequences": 16,
                        "max_sequence_tokens": 32768
                    },
                    "operations": [
                        {
                            "name": "mimo26_resident_decode_stage",
                            "module": "spark.mimo26.flash.resident_decode_stage.mxfp4.h4096.l48.tp4.v1",
                            "configuration": {
                                "qualification_status": "NOT_MEASURED",
                                "production_ready": false,
                                "fallback_allowed": false,
                                "runtime_backend_selection": "forbidden"
                            }
                        }
                    ]
                }
            ]
        }
    ]
}
